### ISSUE TITLE
Problem with k8s audit endpoint

### ISSUE THREAD

**Issue by sofiafernandezmoreno** [falcosecurity/falco#2317]
**Describe the bug**

I managed to run falco on IBM Cloud Kubernetes, the problem is it seems stuck at launch with the k8s-audit endpoint, maybe I failed something somewhere, but for noew healthz endpoint is working fine and also syscall events are working successfully.

How to reproduce it

Installed falco 0.33.1 on IKS with the falco helm chart, here the falco values:

````
# Default values for Falco.

###############################
# General deployment settings #
###############################

image:
  # -- The image pull policy.
  pullPolicy: Always
  # -- The image registry to pull from.
  registry: de.icr.io
  # -- The image repository to pull from
  repository: "{{ imageInstanceLocation }}/{{ falcoImageName }}"
  # -- The image tag to pull. Overrides the image tag whose default is the chart appVersion.
  tag: "{{ falcoImageTag }}"

# -- Secrets containing credentials when pulling from private/secure registries.
imagePullSecrets: 
  - name: "{{ dCoreBaseimagePullSecret }}"

# -- Put here the new name if you want to override the release name used for Falco components.
nameOverride: ""
# -- Same as nameOverride but for the fullname.
fullnameOverride: ""
# -- Override the deployment namespace
namespaceOverride: ""

rbac:
  # Create and use rbac resources when set to true. Needed to fetch k8s metadata from the api-server.
  create: true

serviceAccount:
  # -- Specifies whether a service account should be created.
  create: true
  # -- Annotations to add to the service account.
  annotations: {}
  # -- The name of the service account to use.
  # If not set and create is true, a name is generated using the fullname template
  name: ""
  imagePullSecrets: [ {"name": "{{ dCoreBaseimagePullSecret }}"}]

# -- Add additional pod annotations
podAnnotations: {}

# -- Add additional pod labels
podLabels: {}

# -- Set pod priorityClassName
podPriorityClassName:

# -- Set securityContext for the pods
# These security settings are overriden by the ones specified for the specific
# containers when there is overlap.
podSecurityContext: {}

# Note that `containerSecurityContext`:
#  - will not apply to init containers, if any;
#  - takes precedence over other automatic configurations (see below).
#
# Based on the `driver` configuration the auto generated settings are:
# 1) driver.enabled = false:
#    securityContext: {}
#
# 2) driver.enabled = true and driver.kind = module:
#    securityContext:
#     privileged: true
#
# 3) driver.enabled = true and driver.kind = ebpf:
#    securityContext:
#     privileged: true
#
# 4) driver.enabled = true and driver.kind = ebpf and driver.ebpf.leastPrivileged = true
#    securityContext:
#     capabilities:
#      add:
#      - BPF
#      - SYS_RESOURCE
#      - PERFMON
#      - SYS_PTRACE
#
# -- Set securityContext for the Falco container.For more info see the "falco.securityContext" helper in "pod-template.tpl"
containerSecurityContext: {}

scc:
  # -- Create OpenShift's Security Context Constraint.
  create: true

resources:
  # -- Although resources needed are subjective on the actual workload we provide
  # a sane defaults ones. If you have more questions or concerns, please refer
  # to #falco slack channel for more info about it.
  requests:
    cpu: 100m
    memory: 512Mi
  # -- Maximum amount of resources that Falco container could get.
  # If you are enabling more than one source in falco, than consider to increase
  # the cpu limits.
  limits:
    cpu: 1000m
    memory: 1024Mi
# -- Selectors used to deploy Falco on a given node/nodes.
nodeSelector: {}

# -- Affinity constraint for pods' scheduling.
affinity: {}

# -- Tolerations to allow Falco to run on Kubernetes masters.
tolerations:
  - effect: NoSchedule
    key: node-role.kubernetes.io/master
  - effect: NoSchedule
    key: node-role.kubernetes.io/control-plane

# -- Parameters used
healthChecks:
  livenessProbe:
    # -- Tells the kubelet that it should wait X seconds before performing the first probe.
    initialDelaySeconds: 60
    # -- Number of seconds after which the probe times out.
    timeoutSeconds: 5
    # -- Specifies that the kubelet should perform the check every x seconds.
    periodSeconds: 15
  readinessProbe:
    # -- Tells the kubelet that it should wait X seconds before performing the first probe.
    initialDelaySeconds: 30
    # -- Number of seconds after which the probe times out.
    timeoutSeconds: 5
    # -- Specifies that the kubelet should perform the check every x seconds.
    periodSeconds: 15

# -- Attach the Falco process to a tty inside the container. Needed to flush Falco logs as soon as they are emitted.
# Set it to "true" when you need the Falco logs to be immediately displayed.
tty: false

#########################
# Scenario requirements #
#########################

# Sensors dislocation configuration (scenario requirement)
controller:
  # Available options: deployment, daemonset.
  kind: daemonset
  daemonset:
    updateStrategy:
      # You can also customize maxUnavailable or minReadySeconds if you
      # need it
      # -- Perform rolling updates by default in the DaemonSet agent
      # ref: https://kubernetes.io/docs/tasks/manage-daemon/update-daemon-set/
      type: RollingUpdate
  deployment:
    # -- Number of replicas when installing Falco using a deployment. Change it if you really know what you are doing.
    # For more info check the section on Plugins in the README.md file.
    replicas: 1

# -- Network services configuration (scenario requirement)
# Add here your services to be deployed together with Falco.
services:
  # Example configuration for the "k8sauditlog" plugin
  # - name: k8saudit-webhook
  #   type: NodePort
  #   ports:
  #     - port: 9765 # See plugin open_params
  #       nodePort: 30007
  #       protocol: TCP

# File access configuration (scenario requirement)
mounts:
  # -- A list of volumes you want to add to the Falco pods.
  volumes: []
  # -- A list of volumes you want to add to the Falco pods.
  volumeMounts: []
  # -- By default, `/proc` from the host is only mounted into the Falco pod when `driver.enabled` is set to `true`. This flag allows it to override this behaviour for edge cases where `/proc` is needed but syscall data source is not enabled at the same time (e.g. for specific plugins).
  enforceProcMount: false

# Driver settings (scenario requirement)
driver:
  # -- Set it to false if you want to deploy Falco without the drivers.
  # Always set it to false when using Falco with plugins.
  enabled: true
  # -- Tell Falco which driver to use. Available options: module (kernel driver) and ebpf (eBPF probe).
  kind: module
  # -- Configuration section for ebpf driver.
  ebpf:
    # -- Path where the eBPF probe is located. It comes handy when the probe have been installed in the nodes using tools other than the init
    # container deployed with the chart.
    path:
    # -- Needed to enable eBPF JIT at runtime for performance reasons.
    # Can be skipped if eBPF JIT is enabled from outside the container
    hostNetwork: false
    # -- Constrain Falco with capabilities instead of running a privileged container.
    # This option is only supported with the eBPF driver and a kernel >= 5.8.
    # Ensure the eBPF driver is enabled (i.e., setting the `driver.kind` option to `ebpf`).
    leastPrivileged: false
  # -- Configuration for the Falco init container.
  loader:
    # -- Enable/disable the init container.
    enabled: true
    initContainer:
      # -- Enable/disable the init container.
      enabled: true
      image:
        # -- The image pull policy.
        pullPolicy: Always
        # -- The image registry to pull from.
        registry: de.icr.io
        # -- The image repository to pull from.
        repository: "{{ imageInstanceLocation }}/{{ falcoDriverLoaderImageName }}"
        #  -- Overrides the image tag whose default is the chart appVersion.
        tag: "{{ falcoDriverLoaderImageTag }}"
      # -- Extra environment variables that will be pass onto Falco driver loader init container.
      env: {}
      # -- Arguments to pass to the Falco driver loader init container.
      args: []
      # -- Resources requests and limits for the Falco driver loader init container.
      resources: {}
      # -- Security context for the Falco driver loader init container. Overrides the default security context. If driver.mode == "module" you must at least set `privileged: true`.
      securityContext: {}

# -- Gvisor configuration. Based on your system you need to set the appropriate values.
# Please, rembember to add pod tolerations and affinities in order to schedule the Falco pods in the gVisor enabled nodes.
gvisor:
  # -- Set it to true if you want to deploy Falco with gVisor support.
  enabled: false
  # -- Runsc container runtime configuration. Falco needs to interact with it in order to intercept the activity of the sandboxed pods.
  runsc:
    # -- Absolute path of the `runsc` binary in the k8s nodes.
    path: /home/containerd/usr/local/sbin
    # -- Absolute path of the root directory of the `runsc` container runtime. It is of vital importance for Falco since `runsc` stores there the information of the workloads handled by it;
    root: /run/containerd/runsc
    # -- Absolute path of the `runsc` configuration file, used by Falco to set its configuration and make aware `gVisor` of its presence.
    config: /run/containerd/runsc/config.toml

# Collectors for data enrichment (scenario requirement)
collectors:
  # -- Enable/disable all the metadata collectors.
  enabled: true

  docker:
    # -- Enable Docker support.
    enabled: true   # For Openshift put on false
    # -- The path of the Docker daemon socket.
    socket: /var/run/docker.sock

  containerd:
    # -- Enable ContainerD support.
    enabled: true
    # -- The path of the ContainerD socket.
    socket: /run/containerd/containerd.sock

  crio:
    # -- Enable CRI-O support.
    enabled: true
    # -- The path of the CRI-O socket.
    socket: /run/crio/crio.sock

  kubernetes:
    # -- Enable Kubernetes meta data collection via a connection to the Kubernetes API server.
    # When this option is disabled, Falco falls back to the container annotations to grap the meta data.
    # In such a case, only the ID, name, namespace, labels of the pod will be available.
    enabled: true
    # -- The apiAuth value is to provide the authentication method Falco should use to connect to the Kubernetes API.
    # The argument's documentation from Falco is provided here for reference:
    #
    #  <bt_file> | <cert_file>:<key_file[#password]>[:<ca_cert_file>], --k8s-api-cert <bt_file> | <cert_file>:<key_file[#password]>[:<ca_cert_file>]
    #     Use the provided files names to authenticate user and (optionally) verify the K8S API server identity.
    #     Each entry must specify full (absolute, or relative to the current directory) path to the respective file.
    #     Private key password is optional (needed only if key is password protected).
    #     CA certificate is optional. For all files, only PEM file format is supported.
    #     Specifying CA certificate only is obsoleted - when single entry is provided
    #     for this option, it will be interpreted as the name of a file containing bearer token.
    #     Note that the format of this command-line option prohibits use of files whose names contain
    #     ':' or '#' characters in the file name.
    # -- Provide the authentication method Falco should use to connect to the Kubernetes API.
    apiAuth: /var/run/secrets/kubernetes.io/serviceaccount/token
    ## -- Provide the URL Falco should use to connect to the Kubernetes API.
    apiUrl: "https://$(KUBERNETES_SERVICE_HOST)"
    # -- If true, only the current node (on which Falco is running) will be considered when requesting metadata of pods
    # to the API server. Disabling this option may have a performance penalty on large clusters.
    enableNodeFilter: true

###########################
# Extras and customization #
############################

extra:
  # -- Extra environment variables that will be pass onto Falco containers.
  env: {}
  # -- Extra command-line arguments.
  args: []
  # -- Additional initContainers for Falco pods.
  initContainers: []

# -- certificates used by webserver and grpc server.
# paste certificate content or use helm with --set-file
# or use existing secret containing key, crt, ca as well as pem bundle
certs:
  # -- Existing secret containing the following key, crt and ca as well as the bundle pem.
  existingSecret: ""
  server:
    # -- Key used by gRPC and webserver.
    key: "{{ serverkeyB64 }}"
    # -- Certificate used by gRPC and webserver.
    crt: "{{ serverCertB64 }}"
  ca:
    # -- CA certificate used by gRPC, webserver and AuditSink validation.
    crt: "{{ caB64 }}"
# -- Third party rules enabled for Falco. More info on the dedicated section in README.md file.
customRules:
  {}
  # Although Falco comes with a nice default rule set for detecting weird
  # behavior in containers, our users are going to customize the run-time
  # security rule sets or policies for the specific container images and
  # applications they run. This feature can be handled in this section.
  #
  # Example:
  #
  # rules-traefik.yaml: |-
  #   [ rule body ]

########################
# Falco integrations   #
########################

# -- For configuration values, see https://github.com/falcosecurity/charts/blob/master/falcosidekick/values.yaml
falcosidekick:
  # -- Enable falcosidekick deployment.
  enabled: false
  # -- Enable usage of full FQDN of falcosidekick service (useful when a Proxy is used).
  fullfqdn: false
  # -- Listen port. Default value: 2801
  listenPort: ""

######################
# falco.yaml config  #
######################
falco:
# File(s) or Directories containing Falco rules, loaded at startup.
# The name "rules_file" is only for backwards compatibility.
# If the entry is a file, it will be read directly. If the entry is a directory,
# every file in that directory will be read, in alphabetical order.
#
# falco_rules.yaml ships with the falco package and is overridden with
# every new software version. falco_rules.local.yaml is only created
# if it doesn't exist. If you want to customize the set of rules, add
# your customizations to falco_rules.local.yaml.
#
# The files will be read in the order presented here, so make sure if
# you have overrides they appear in later files.
  # -- The location of the rules files that will be consumed by Falco.
  rules_file:
    - /etc/falco/falco_rules.yaml
    - /etc/falco/falco_rules.local.yaml
    - /etc/falco/rules.d
    - /etc/falco/k8s_audit_rules.yaml

  #
  # Plugins that are available for use. These plugins are not loaded by
  # default, as they require explicit configuration to point to
  # cloudtrail log files.
  #

  # To learn more about the supported formats for
  # init_config/open_params for the cloudtrail plugin, see the README at
  # https://github.com/falcosecurity/plugins/blob/master/plugins/cloudtrail/README.md.
  # -- Plugins configuration. Add here all plugins and their configuration. Please
  # consult the plugins documentation for more info. Remember to add the plugins name in
  # "load_plugins: []" in order to load them in Falco.
  plugins:
    - name: k8saudit
      library_path: libk8saudit.so
      init_config:
      #   maxEventSize: 262144
      #   webhookMaxBatchSize: 12582912
      #   sslCertificate: /etc/falco/falco.pem
      open_params: "http://:9765/k8s-audit"
    - name: cloudtrail
      library_path: libcloudtrail.so
      # see docs for init_config and open_params:
      # https://github.com/falcosecurity/plugins/blob/master/plugins/cloudtrail/README.md
    - name: json
      library_path: libjson.so
      init_config: ""

  # Setting this list to empty ensures that the above plugins are *not*
  # loaded and enabled by default. If you want to use the above plugins,
  # set a meaningful init_config/open_params for the cloudtrail plugin
  # and then change this to:
  # load_plugins: [cloudtrail, json]
  # -- Add here the names of the plugins that you want to be loaded by Falco. Please make sure that
  # plugins have been configured under the "plugins" section before adding them here.
  load_plugins: [k8saudit,json]

  # -- Watch config file and rules files for modification.
  # When a file is modified, Falco will propagate new config,
  # by reloading itself.
  watch_config_files: true

  # -- If true, the times displayed in log messages and output messages
  # will be in ISO 8601. By default, times are displayed in the local
  # time zone, as governed by /etc/localtime.
  time_format_iso_8601: false

  # -- If "true", print falco alert messages and rules file
  # loading/validation results as json, which allows for easier
  # consumption by downstream programs. Default is "false".
  json_output: true

  # -- When using json output, whether or not to include the "output" property
  # itself (e.g. "File below a known binary directory opened for writing
  # (user=root ....") in the json output.
  json_include_output_property: true

  # -- When using json output, whether or not to include the "tags" property
  # itself in the json output. If set to true, outputs caused by rules
  # with no tags will have a "tags" field set to an empty array. If set to
  # false, the "tags" field will not be included in the json output at all.
  json_include_tags_property: true

  # -- Send information logs to stderr. Note these are *not* security
  # notification logs! These are just Falco lifecycle (and possibly error) logs.
  log_stderr: true
  # -- Send information logs to syslog. Note these are *not* security
  # notification logs! These are just Falco lifecycle (and possibly error) logs.
  log_syslog: true

  # -- Minimum log level to include in logs. Note: these levels are
  # separate from the priority field of rules. This refers only to the
  # log level of falco's internal logging. Can be one of "emergency",
  # "alert", "critical", "error", "warning", "notice", "info", "debug".
  log_level: info

  # Falco is capable of managing the logs coming from libs. If enabled,
  # the libs logger send its log records the same outputs supported by
  # Falco (stderr and syslog). Disabled by default.
  libs_logger:
    # -- Enable the libs logger.
    enabled: false
    # -- Minimum log severity to include in the libs logs. Note: this value is
    # separate from the log level of the Falco logger and does not affect it.
    # Can be one of "fatal", "critical", "error", "warning", "notice",
    # "info", "debug", "trace".
    severity: debug

  # -- Minimum rule priority level to load and run. All rules having a
  # priority more severe than this level will be loaded/run.  Can be one
  # of "emergency", "alert", "critical", "error", "warning", "notice",
  # "informational", "debug".
  priority: debug

  # -- Whether or not output to any of the output channels below is
  # buffered. Defaults to false
  buffered_outputs: false

  # Falco uses a shared buffer between the kernel and userspace to pass
  # system call information. When Falco detects that this buffer is
  # full and system calls have been dropped, it can take one or more of
  # the following actions:
  #   - ignore: do nothing (default when list of actions is empty)
  #   - log: log a DEBUG message noting that the buffer was full
  #   - alert: emit a Falco alert noting that the buffer was full
  #   - exit: exit Falco with a non-zero rc
  #
  # Notice it is not possible to ignore and log/alert messages at the same time.
  #
  # The rate at which log/alert messages are emitted is governed by a
  # token bucket. The rate corresponds to one message every 30 seconds
  # with a burst of one message (by default).
  #
  # The messages are emitted when the percentage of dropped system calls
  # with respect the number of events in the last second
  # is greater than the given threshold (a double in the range [0, 1]).
  #
  # For debugging/testing it is possible to simulate the drops using
  # the `simulate_drops: true`. In this case the threshold does not apply.

  syscall_event_drops:
    # -- The messages are emitted when the percentage of dropped system calls
    # with respect the number of events in the last second
    # is greater than the given threshold (a double in the range [0, 1]).
    threshold: .1
    # -- Actions to be taken when system calls were dropped from the circular buffer.
    actions:
      - log
      - alert
    # -- Rate at which log/alert messages are emitted.
    rate: .03333
    # -- Max burst of messages emitted.
    max_burst: 1

  # Falco uses a shared buffer between the kernel and userspace to receive
  # the events (eg., system call information) in userspace.
  #
  # Anyways, the underlying libraries can also timeout for various reasons.
  # For example, there could have been issues while reading an event.
  # Or the particular event needs to be skipped.
  # Normally, it's very unlikely that Falco does not receive events consecutively.
  #
  # Falco is able to detect such uncommon situation.
  #
  # Here you can configure the maximum number of consecutive timeouts without an event
  # after which you want Falco to alert.
  # By default this value is set to 1000 consecutive timeouts without an event at all.
  # How this value maps to a time interval depends on the CPU frequency.

  syscall_event_timeouts:
    # -- Maximum number of consecutive timeouts without an event
    # after which you want Falco to alert.
    max_consecutives: 1000

  # --- [Description]
  #
  # This is an index that controls the dimension of the syscall buffers.
  # The syscall buffer is the shared space between Falco and its drivers where all the syscall events
  # are stored.
  # Falco uses a syscall buffer for every online CPU, and all these buffers share the same dimension.
  # So this parameter allows you to control the size of all the buffers!
  #
  # --- [Usage]
  #
  # You can choose between different indexes: from `1` to `10` (`0` is reserved for future uses).
  # Every index corresponds to a dimension in bytes:
  #
  # [(*), 1 MB, 2 MB, 4 MB, 8 MB, 16 MB, 32 MB, 64 MB, 128 MB, 256 MB, 512 MB]
  #   ^    ^     ^     ^     ^     ^      ^      ^       ^       ^       ^
  #   |    |     |     |     |     |      |      |       |       |       |
  #   0    1     2     3     4     5      6      7       8       9       10
  #
  # As you can see the `0` index is reserved, while the index `1` corresponds to
  # `1 MB` and so on.
  #
  # These dimensions in bytes derive from the fact that the buffer size must be:
  # (1) a power of 2.
  # (2) a multiple of your system_page_dimension.
  # (3) greater than `2 * (system_page_dimension)`.
  #
  # According to these constraints is possible that sometimes you cannot use all the indexes, let's consider an
  # example to better understand it:
  # If you have a `page_size` of 1 MB the first available buffer size is 4 MB because 2 MB is exactly
  # `2 * (system_page_size)` -> `2 * 1 MB`, but this is not enough we need more than `2 * (system_page_size)`!
  # So from this example is clear that if you have a page size of 1 MB the first index that you can use is `3`.
  #
  # Please note: this is a very extreme case just to let you understand the mechanism, usually the page size is something
  # like 4 KB so you have no problem at all and you can use all the indexes (from `1` to `10`).
  #
  # To check your system page size use the Falco `--page-size` command line option. The output on a system with a page
  # size of 4096 Bytes (4 KB) should be the following:
  #
  # "Your system page size is: 4096 bytes."
  #
  # --- [Suggestions]
  #
  # Before the introduction of this param the buffer size was fixed to 8 MB (so index `4`, as you can see
  # in the default value below).
  # You can increase the buffer size when you face syscall drops. A size of 16 MB (so index `5`) can reduce
  # syscall drops in production-heavy systems without noticeable impact. Very large buffers however could
  # slow down the entire machine.
  # On the other side you can try to reduce the buffer size to speed up the system, but this could
  # increase the number of syscall drops!
  # As a final remark consider that the buffer size is mapped twice in the process' virtual memory so a buffer of 8 MB
  # will result in a 16 MB area in the process virtual memory.
  # Please pay attention when you use this parameter and change it only if the default size doesn't fit your use case.
  # -- This is an index that controls the dimension of the syscall buffers.
  syscall_buf_size_preset: 4

  # Falco continuously monitors outputs performance. When an output channel does not allow
  # to deliver an alert within a given deadline, an error is reported indicating
  # which output is blocking notifications.
  # The timeout error will be reported to the log according to the above log_* settings.
  # Note that the notification will not be discarded from the output queue; thus,
  # output channels may indefinitely remain blocked.
  # An output timeout error indeed indicate a misconfiguration issue or I/O problems
  # that cannot be recovered by Falco and should be fixed by the user.
  #
  # The "output_timeout" value specifies the duration in milliseconds to wait before
  # considering the deadline exceed.
  #
  # With a 2000ms default, the notification consumer can block the Falco output
  # for up to 2 seconds without reaching the timeout.
  # -- Duration in milliseconds to wait before considering the output timeout deadline exceed.
  output_timeout: 2000

  # A throttling mechanism implemented as a token bucket limits the
  # rate of Falco notifications. One rate limiter is assigned to each event
  # source, so that alerts coming from one can't influence the throttling
  # mechanism of the others. This is controlled by the following options:
  #  - rate: the number of tokens (i.e. right to send a notification)
  #    gained per second. When 0, the throttling mechanism is disabled.
  #    Defaults to 0.
  #  - max_burst: the maximum number of tokens outstanding. Defaults to 1000.
  #
  # With these defaults, the throttling mechanism is disabled.
  # For example, by setting rate to 1 Falco could send up to 1000 notifications
  # after an initial quiet period, and then up to 1 notification per second
  # afterward. It would gain the full burst back after 1000 seconds of
  # no activity.

  outputs:
    # -- Number of tokens gained per second.
    rate: 1
    # -- Maximum number of tokens outstanding.
    max_burst: 1000

  # Where security notifications should go.
  # Multiple outputs can be enabled.

  syslog_output:
    # -- Enable syslog output for security notifications.
    enabled: true

  # If keep_alive is set to true, the file will be opened once and
  # continuously written to, with each output message on its own
  # line. If keep_alive is set to false, the file will be re-opened
  # for each output message.
  #
  # Also, the file will be closed and reopened if falco is signaled with
  # SIGUSR1.

  file_output:
    # -- Enable file output for security notifications.
    enabled: false
    # -- Open file once or every time a new notification arrives.
    keep_alive: false
    # -- The filename for logging notifications.
    filename: ./events.txt

  stdout_output:
    # -- Enable stdout output for security notifications.
    enabled: true

  # Falco contains an embedded webserver that exposes a healthy endpoint that can be used to check if Falco is up and running.
  # By default the endpoint is /healthz
  #
  # The ssl_certificate is a combination SSL Certificate and corresponding
  # key contained in a single file. You can generate a key/cert as follows:
  #
  # $ openssl req -newkey rsa:2048 -nodes -keyout key.pem -x509 -days 365 -out certificate.pem
  # $ cat certificate.pem key.pem > falco.pem
  # $ sudo cp falco.pem /etc/falco/falco.pem
  webserver:
    # -- Enable Falco embedded webserver.
    enabled: true
    # -- Port where Falco embedded webserver listen to connections.
    listen_port: 8765
    # -- Endpoint where Falco exposes the health status.
    k8s_healthz_endpoint: /healthz
    # -- Enable SSL on Falco embedded webserver.
    ssl_enabled: false
    # -- Certificate bundle path for the Falco embedded webserver.
    ssl_certificate: /etc/falco/falco.pem

  # Possible additional things you might want to do with program output:
  #   - send to a slack webhook:
  #         program: "jq '{text: .output}' | curl -d @- -X POST https://hooks.slack.com/services/XXX"
  #   - logging (alternate method than syslog):
  #         program: logger -t falco-test
  #   - send over a network connection:
  #         program: nc host.example.com 80

  # If keep_alive is set to true, the program will be started once and
  # continuously written to, with each output message on its own
  # line. If keep_alive is set to false, the program will be re-spawned
  # for each output message.
  #
  # Also, the program will be closed and reopened if falco is signaled with
  # SIGUSR1.
  program_output:
    # -- Enable program output for security notifications.
    enabled: false
    # -- Start the program once or re-spawn when a notification arrives.
    keep_alive: false
    # -- Command to execute for program output.
    program: "jq '{text: .output}' | curl -d @- -X POST https://hooks.slack.com/services/XXX"

  http_output:
    # -- Enable http output for security notifications.
    enabled: true
    # -- When set, this will override an auto-generated URL which matches the falcosidekick Service.
    # -- When including Falco inside a parent helm chart, you must set this since the auto-generated URL won't match (#280).
    url: "http://falcosidekick:2801"
    user_agent: "falcosecurity/falco"

  # Falco supports running a gRPC server with two main binding types
  # 1. Over the network with mandatory mutual TLS authentication (mTLS)
  # 2. Over a local unix socket with no authentication
  # By default, the gRPC server is disabled, with no enabled services (see grpc_output)
  # please comment/uncomment and change accordingly the options below to configure it.
  # Important note: if Falco has any troubles creating the gRPC server
  # this information will be logged, however the main Falco daemon will not be stopped.
  # gRPC server over network with (mandatory) mutual TLS configuration.
  # This gRPC server is secure by default so you need to generate certificates and update their paths here.
  # By default the gRPC server is off.
  # You can configure the address to bind and expose it.
  # By modifying the threadiness configuration you can fine-tune the number of threads (and context) it will use.
  # grpc:
  #   enabled: true
  #   bind_address: "0.0.0.0:5060"
  #   # when threadiness is 0, Falco sets it by automatically figuring out the number of online cores
  #   threadiness: 0
  #   private_key: "/etc/falco/certs/server.key"
  #   cert_chain: "/etc/falco/certs/server.crt"
  #   root_certs: "/etc/falco/certs/ca.crt"

  # -- gRPC server using an unix socket
  grpc:
    # -- Enable the Falco gRPC server.
    enabled: true
    # -- Bind address for the grpc server.
    bind_address: "unix:///run/falco/falco.sock"
    # -- Number of threads (and context) the gRPC server will use, 0 by default, which means "auto".
    threadiness: 0

  # gRPC output service.
  # By default it is off.
  # By enabling this all the output events will be kept in memory until you read them with a gRPC client.
  # Make sure to have a consumer for them or leave this disabled.
  grpc_output:
    # -- Enable the gRPC output and events will be kept in memory until you read them with a gRPC client.
    enabled: true

  # Container orchestrator metadata fetching params
  metadata_download:
    # -- Max allowed response size (in Mb) when fetching metadata from Kubernetes.
    max_mb: 100
    # -- Sleep time (in μs) for each download chunck when fetching metadata from Kubernetes.
    chunk_wait_us: 1000
    # -- Watch frequency (in seconds) when fetching metadata from Kubernetes.
    watch_freq_sec: 1
	
````
And here the falco output:

````
   sfernandez   ~  kubectl logs -f -n d-runtime-audit falco-fpx5h                                                                                                                                     13:11:07    172.22.86.137 
Defaulted container "falco" out of: falco, falco-driver-loader (init)
Mon Dec 12 11:57:29 2022: Falco version: 0.33.1 (x86_64)
Mon Dec 12 11:57:29 2022: Falco initialized with configuration file: /etc/falco/falco.yaml
Mon Dec 12 11:57:29 2022: Loading plugin 'k8saudit' from file /usr/share/falco/plugins/libk8saudit.so
Mon Dec 12 11:57:29 2022: Loading plugin 'json' from file /usr/share/falco/plugins/libjson.so
Mon Dec 12 11:57:29 2022: Loading rules from file /etc/falco/falco_rules.yaml
Mon Dec 12 11:57:29 2022: Loading rules from file /etc/falco/falco_rules.local.yaml
Mon Dec 12 11:57:29 2022: Loading rules from file /etc/falco/k8s_audit_rules.yaml
Mon Dec 12 11:57:30 2022: The chosen syscall buffer dimension is: 8388608 bytes (8 MBs)
Mon Dec 12 11:57:30 2022: gRPC server threadiness equals to 4
Mon Dec 12 11:57:30 2022: Starting health webserver with threadiness 4, listening on port 8765
Mon Dec 12 11:57:30 2022: Starting gRPC server at unix:///run/falco/falco.sock
Mon Dec 12 11:57:30 2022: Enabled event sources: k8s_audit, syscall
Mon Dec 12 11:57:30 2022: Opening capture with plugin 'k8saudit'
Mon Dec 12 11:57:30 2022: Opening capture with Kernel module
{"hostname":"falco-fpx5h","output":"11:57:34.740194881: Notice Unexpected connection to K8s API Server from container (command=falco --cri /run/containerd/containerd.sock --cri /run/crio/crio.sock -K /var/run/secrets/kubernetes.io/serviceaccount/token -k https://172.21.0.1 --k8s-node 10.135.181.244 -pk pid=26247 k8s.ns=d-runtime-audit k8s.pod=falco-fpx5h container=cfda38995efb image=de.icr.io/d-core-base-dev-eu/d-runtime-audit_falco-no-driver:0.33.1-1.0.0 connection=172.30.225.233:40520->172.21.0.1:443)","priority":"Notice","rule":"Contact K8S API Server From Container","source":"syscall","tags":["container","k8s","mitre_discovery","network"],"time":"2022-12-12T11:57:34.740194881Z", "output_fields": {"container.id":"cfda38995efb","container.image.repository":"de.icr.io/d-core-base-dev-eu/d-runtime-audit_falco-no-driver","container.image.tag":"0.33.1-1.0.0","evt.time":1670846254740194881,"fd.name":"172.30.225.233:40520->172.21.0.1:443","k8s.ns.name":"d-runtime-audit","k8s.pod.name":"falco-fpx5h","proc.cmdline":"falco --cri /run/containerd/containerd.sock --cri /run/crio/crio.sock -K /var/run/secrets/kubernetes.io/serviceaccount/token -k https://172.21.0.1 --k8s-node 10.135.181.244 -pk","proc.pid":26247}}
{"hostname":"falco-fpx5h","output":"11:57:35.031900926: Notice Unexpected connection to K8s API Server from container (command=falco --cri /run/containerd/containerd.sock --cri /run/crio/crio.sock -K /var/run/secrets/kubernetes.io/serviceaccount/token -k https://172.21.0.1 --k8s-node 10.135.181.244 -pk pid=26247 k8s.ns=d-runtime-audit k8s.pod=falco-fpx5h container=cfda38995efb image=de.icr.io/d-core-base-dev-eu/d-runtime-audit_falco-no-driver:0.33.1-1.0.0 connection=172.30.225.233:40522->172.21.0.1:443)","priority":"Notice","rule":"Contact K8S API Server From Container","source":"syscall","tags":["container","k8s","mitre_discovery","network"],"time":"2022-12-12T11:57:35.031900926Z", "output_fields": {"container.id":"cfda38995efb","container.image.repository":"de.icr.io/d-core-base-dev-eu/d-runtime-audit_falco-no-driver","container.image.tag":"0.33.1-1.0.0","evt.time":1670846255031900926,"fd.name":"172.30.225.233:40522->172.21.0.1:443","k8s.ns.name":"d-runtime-audit","k8s.pod.name":"falco-fpx5h","proc.cmdline":"falco --cri /run/containerd/containerd.sock --cri /run/crio/crio.sock -K /var/run/secrets/kubernetes.io/serviceaccount/token -k https://172.21.0.1 --k8s-node 10.135.181.244 -pk","proc.pid":26247}}
````
Then k8s audit endpoint is not available for use it:
````
root@falco-fzl7x:/# ifconfig
eth0: flags=4163<UP,BROADCAST,RUNNING,MULTICAST>  mtu 1480
        inet 172.30.225.193  netmask 255.255.255.255  broadcast 0.0.0.0
        inet6 fe80::1c5e:9ff:fe89:4870  prefixlen 64  scopeid 0x20<link>
        ether 1e:5e:09:89:48:70  txqueuelen 0  (Ethernet)
        RX packets 1702  bytes 14273905 (13.6 MiB)
        RX errors 0  dropped 0  overruns 0  frame 0
        TX packets 1430  bytes 139050 (135.7 KiB)
        TX errors 0  dropped 1 overruns 0  carrier 0  collisions 0

lo: flags=73<UP,LOOPBACK,RUNNING>  mtu 65536
        inet 127.0.0.1  netmask 255.0.0.0
        inet6 ::1  prefixlen 128  scopeid 0x10<host>
        loop  txqueuelen 1000  (Local Loopback)
        RX packets 0  bytes 0 (0.0 B)
        RX errors 0  dropped 0  overruns 0  frame 0
        TX packets 0  bytes 0 (0.0 B)
        TX errors 0  dropped 0 overruns 0  carrier 0  collisions 0

root@falco-fzl7x:/# curl http://172.30.225.193:9765/
curl: (7) Failed to connect to 172.30.225.193 port 9765: Connection refused
root@falco-fzl7x:/# curl -vlk http://172.30.225.193:8765/healthz
*   Trying 172.30.225.193:8765...
* Connected to 172.30.225.193 (172.30.225.193) port 8765 (#0)
> GET /healthz HTTP/1.1
> Host: 172.30.225.193:8765
> User-Agent: curl/7.74.0
> Accept: */*
>
* Mark bundle as not supporting multiuse
< HTTP/1.1 200 OK
< Content-Length: 16
< Content-Type: application/json
< Keep-Alive: timeout=5, max=5
<
* Connection #0 to host 172.30.225.193 left intact
{"status": "ok"}root@falco-fzl7x:/#
root@falco-fzl7x:/#

````

````
root@falco-fpx5h:/# netstat -lntup
Active Internet connections (only servers)
Proto Recv-Q Send-Q Local Address           Foreign Address         State       PID/Program name
tcp        0      0 0.0.0.0:8765            0.0.0.0:*               LISTEN      1/falco
[1:06](https://kubernetes.slack.com/archives/D04FG2WPE2C/p1670846813022259)

root@falco-fpx5h:/# tcpdump -vv port 9765
tcpdump: listening on eth0, link-type EN10MB (Ethernet), snapshot length 262144 bytes
^C
0 packets captured
0 packets received by filter
0 packets dropped by kernel
root@falco-fpx5h:/# tcpdump -vv port 8765
tcpdump: listening on eth0, link-type EN10MB (Ethernet), snapshot length 262144 bytes
12:06:39.072071 IP (tos 0x0, ttl 64, id 29080, offset 0, flags [DF], proto TCP (6), length 60)
    10-135-181-244.calico-typha.kube-system.svc.cluster.local.9193 > falco-fpx5h.8765: Flags [S], cksum 0x4eb2 (incorrect -> 0x7c20), seq 1103366603, win 65535, options [mss 1440,sackOK,TS val 2126802164 ecr 0,nop,wscale 9], length 0
12:06:39.072073 IP (tos 0x0, ttl 64, id 16743, offset 0, flags [DF], proto TCP (6), length 60)
    10-135-181-244.calico-typha.kube-system.svc.cluster.local.9195 > falco-fpx5h.8765: Flags [S], cksum 0x4eb2 (incorrect -> 0x347d), seq 2973622770, win 65535, options [mss 1440,sackOK,TS val 2126802164 ecr 0,nop,wscale 9], length 0
12:06:39.072095 IP (tos 0x0, ttl 64, id 0, offset 0, flags [DF], proto TCP (6), length 60)
    falco-fpx5h.8765 > 10-135-181-244.calico-typha.kube-system.svc.cluster.local.9195: Flags [S.], cksum 0x4eb2 (incorrect -> 0x7ff3), seq 702648647, ack 2973622771, win 65535, options [mss 1440,sackOK,TS val 2031910963 ecr 2126802164,nop,wscale 9], length 0
12:06:39.072092 IP (tos 0x0, ttl 64, id 0, offset 0, flags [DF], proto TCP (6), length 60)
    falco-fpx5h.8765 > 10-135-181-244.calico-typha.kube-system.svc.cluster.local.9193: Flags [S.], cksum 0x4eb2 (incorrect -> 0x7e47), seq 474081334, ack 1103366604, win 65535, options [mss 1440,sackOK,TS val 2031910963 ecr 2126802164,nop,wscale 9], length 0
12:06:39.072119 IP (tos 0x0, ttl 64, id 16744, offset 0, flags [DF], proto TCP (6), length 52)
    10-135-181-244.calico-typha.kube-system.svc.cluster.local.9195 > falco-fpx5h.8765: Flags [.], cksum 0x4eaa (incorrect -> 0xae2d), seq 1, ack 1, win 128, options [nop,nop,TS val 2126802164 ecr 2031910963], length 0
12:06:39.072117 IP (tos 0x0, ttl 64, id 29081, offset 0, flags [DF], proto TCP (6), length 52)
    10-135-181-244.calico-typha.kube-system.svc.cluster.local.9193 > falco-fpx5h.8765: Flags [.], cksum 0x4eaa (incorrect -> 0xac81), seq 1, ack 1, win 128, options [nop,nop,TS val 2126802164 ecr 2031910963], length 0
12:06:39.072305 IP (tos 0x0, ttl 64, id 29082, offset 0, flags [DF], proto TCP (6), length 165)
    10-135-181-244.calico-typha.kube-system.svc.cluster.local.9193 > falco-fpx5h.8765: Flags [P.], cksum 0x4f1b (incorrect -> 0x1452), seq 1:114, ack 1, win 128, options [nop,nop,TS val 2126802164 ecr 2031910963], length 113
12:06:39.072309 IP (tos 0x0, ttl 64, id 16745, offset 0, flags [DF], proto TCP (6), length 165)
    10-135-181-244.calico-typha.kube-system.svc.cluster.local.9195 > falco-fpx5h.8765: Flags [P.], cksum 0x4f1b (incorrect -> 0x15fe), seq 1:114, ack 1, win 128, options [nop,nop,TS val 2126802164 ecr 2031910963], length 113
12:06:39.072312 IP (tos 0x0, ttl 64, id 49172, offset 0, flags [DF], proto TCP (6), length 52)
    falco-fpx5h.8765 > 10-135-181-244.calico-typha.kube-system.svc.cluster.local.9193: Flags [.], cksum 0x4eaa (incorrect -> 0xac10), seq 1, ack 114, win 128, options [nop,nop,TS val 2031910963 ecr 2126802164], length 0
12:06:39.072313 IP (tos 0x0, ttl 64, id 22388, offset 0, flags [DF], proto TCP (6), length 52)
    falco-fpx5h.8765 > 10-135-181-244.calico-typha.kube-system.svc.cluster.local.9195: Flags [.], cksum 0x4eaa (incorrect -> 0xadbc), seq 1, ack 114, win 128, options [nop,nop,TS val 2031910963 ecr 2126802164], length 0
12:06:39.072443 IP (tos 0x0, ttl 64, id 49173, offset 0, flags [DF], proto TCP (6), length 142)
    falco-fpx5h.8765 > 10-135-181-244.calico-typha.kube-system.svc.cluster.local.9193: Flags [P.], cksum 0x4f04 (incorrect -> 0x9f94), seq 1:91, ack 114, win 128, options [nop,nop,TS val 2031910963 ecr 2126802164], length 90
12:06:39.072484 IP (tos 0x0, ttl 64, id 29083, offset 0, flags [DF], proto TCP (6), length 52)
    10-135-181-244.calico-typha.kube-system.svc.cluster.local.9193 > falco-fpx5h.8765: Flags [.], cksum 0x4eaa (incorrect -> 0xabb6), seq 114, ack 91, win 128, options [nop,nop,TS val 2126802164 ecr 2031910963], length 0
12:06:39.072513 IP (tos 0x0, ttl 64, id 49174, offset 0, flags [DF], proto TCP (6), length 68)
    falco-fpx5h.8765 > 10-135-181-244.calico-typha.kube-system.svc.cluster.local.9193: Flags [P.], cksum 0x4eba (incorrect -> 0x11db), seq 91:107, ack 114, win 128, options [nop,nop,TS val 2031910963 ecr 2126802164], length 16
12:06:39.072523 IP (tos 0x0, ttl 64, id 29084, offset 0, flags [DF], proto TCP (6), length 52)
    10-135-181-244.calico-typha.kube-system.svc.cluster.local.9193 > falco-fpx5h.8765: Flags [.], cksum 0x4eaa (incorrect -> 0xaba6), seq 114, ack 107, win 128, options [nop,nop,TS val 2126802164 ecr 2031910963], length 0
12:06:39.072535 IP (tos 0x0, ttl 64, id 49175, offset 0, flags [DF], proto TCP (6), length 52)
    falco-fpx5h.8765 > 10-135-181-244.calico-typha.kube-system.svc.cluster.local.9193: Flags [F.], cksum 0x4eaa (incorrect -> 0xaba5), seq 107, ack 114, win 128, options [nop,nop,TS val 2031910963 ecr 2126802164], length 0
12:06:39.072597 IP (tos 0x0, ttl 64, id 29085, offset 0, flags [DF], proto TCP (6), length 52)
    10-135-181-244.calico-typha.kube-system.svc.cluster.local.9193 > falco-fpx5h.8765: Flags [F.], cksum 0x4eaa (incorrect -> 0xaba4), seq 114, ack 108, win 128, options [nop,nop,TS val 2126802164 ecr 2031910963], length 0
12:06:39.072609 IP (tos 0x0, ttl 64, id 49176, offset 0, flags [DF], proto TCP (6), length 52)
    falco-fpx5h.8765 > 10-135-181-244.calico-typha.kube-system.svc.cluster.local.9193: Flags [.], cksum 0x4eaa (incorrect -> 0xaba4), seq 108, ack 115, win 128, options [nop,nop,TS val 2031910963 ecr 2126802164], length 0
12:06:39.072698 IP (tos 0x0, ttl 64, id 22389, offset 0, flags [DF], proto TCP (6), length 142)
    falco-fpx5h.8765 > 10-135-181-244.calico-typha.kube-system.svc.cluster.local.9195: Flags [P.], cksum 0x4f04 (incorrect -> 0xa13f), seq 1:91, ack 114, win 128, options [nop,nop,TS val 2031910964 ecr 2126802164], length 90
12:06:39.072708 IP (tos 0x0, ttl 64, id 16746, offset 0, flags [DF], proto TCP (6), length 52)
    10-135-181-244.calico-typha.kube-system.svc.cluster.local.9195 > falco-fpx5h.8765: Flags [.], cksum 0x4eaa (incorrect -> 0xad60), seq 114, ack 91, win 128, options [nop,nop,TS val 2126802165 ecr 2031910964], length 0
12:06:39.072734 IP (tos 0x0, ttl 64, id 22390, offset 0, flags [DF], proto TCP (6), length 68)
    falco-fpx5h.8765 > 10-135-181-244.calico-typha.kube-system.svc.cluster.local.9195: Flags [P.], cksum 0x4eba (incorrect -> 0x1385), seq 91:107, ack 114, win 128, options [nop,nop,TS val 2031910964 ecr 2126802165], length 16
12:06:39.072744 IP (tos 0x0, ttl 64, id 16747, offset 0, flags [DF], proto TCP (6), length 52)
    10-135-181-244.calico-typha.kube-system.svc.cluster.local.9195 > falco-fpx5h.8765: Flags [.], cksum 0x4eaa (incorrect -> 0xad50), seq 114, ack 107, win 128, options [nop,nop,TS val 2126802165 ecr 2031910964], length 0
12:06:39.072752 IP (tos 0x0, ttl 64, id 22391, offset 0, flags [DF], proto TCP (6), length 52)
    falco-fpx5h.8765 > 10-135-181-244.calico-typha.kube-system.svc.cluster.local.9195: Flags [F.], cksum 0x4eaa (incorrect -> 0xad4f), seq 107, ack 114, win 128, options [nop,nop,TS val 2031910964 ecr 2126802165], length 0
12:06:39.072803 IP (tos 0x0, ttl 64, id 16748, offset 0, flags [DF], proto TCP (6), length 52)
    10-135-181-244.calico-typha.kube-system.svc.cluster.local.9195 > falco-fpx5h.8765: Flags [F.], cksum 0x4eaa (incorrect -> 0xad4e), seq 114, ack 108, win 128, options [nop,nop,TS val 2126802165 ecr 2031910964], length 0
12:06:39.072813 IP (tos 0x0, ttl 64, id 22392, offset 0, flags [DF], proto TCP (6), length 52)
    falco-fpx5h.8765 > 10-135-181-244.calico-typha.kube-system.svc.cluster.local.9195: Flags [.], cksum 0x4eaa (incorrect -> 0xad4e), seq 108, ack 115, win 128, options [nop,nop,TS val 2031910964 ecr 2126802165], length 0
^C
24 packets captured
24 packets received by filter
0 packets dropped by kernel
````
Environment

Falco version:
0.33.1
System info:
````
* Looking for a falco module locally (kernel 4.15.0-194-generic)
* Filename 'falco_ubuntu-generic_4.15.0-194-generic_205.ko' is composed of:
 - driver name: falco
 - target identifier: ubuntu-generic
 - kernel release: 4.15.0-194-generic
 - kernel version: 205
````

**Comment by jasondellaluce** [comment]
At first sight, this seems like an issue with how the charts are configured, because Falco seems to load the plugin and the event sources as expected.

cc @alacuku

**Comment by alacuku** [comment]
I'm debugging the issue with Sofia, once we have a solution will post an update here.

**Comment by sofiafernandezmoreno** [comment]
Problem resolved but the problem persists with the kind of kube-audit events when we use Fluentbit to gather logs to Falco, in IKS it's not compatible
