### ISSUE TITLE
Problem with k8s-audit endpoint and port 9765 in Falco deployment

### ISSUE THREAD

**Issue by sofiafernandezmoreno** [falcosecurity/falco#2319]
Hi this morning i tried to install Falco in my IKS but i noticed that port 9765 is not reachable in Falco, i enabled k8s-audit. I tested with sending the audit event to falco using curl:
````
# curl -H "Content-Type: application/json" --data @event.json http://localhost:9765/k8s-audit -v
*   Trying ::1:9765...
* Connected to localhost (::1) port 9765 (#0)
> POST /k8s-audit HTTP/1.1
> Host: localhost:9765
> User-Agent: curl/7.74.0
> Accept: */*
> Content-Type: application/json
> Content-Length: 780
>
* upload completely sent off: 780 out of 780 bytes
* Mark bundle as not supporting multiuse
< HTTP/1.1 200 OK
< Date: Tue, 13 Dec 2022 12:19:43 GMT
< Content-Length: 0
<
* Connection #0 to host localhost left intact
````

And meanwhile i checked the packets:

`````
# tcpdump -vv port 9765
tcpdump: listening on eth0, link-type EN10MB (Ethernet), snapshot length 262144 bytes
^C
0 packets captured
5 packets received by filter
0 packets dropped by kernel
`````

`````
# tcpdump -vv dst port 8765
tcpdump: listening on eth0, link-type EN10MB (Ethernet), snapshot length 262144 bytes
12:12:25.331758 IP (tos 0x0, ttl 64, id 14068, offset 0, flags [DF], proto TCP (6), length 60)
    10-135-181-241.calico-typha.kube-system.svc.cluster.local.43005 > falco-gpms5.8765: Flags [S], cksum 0xb068 (incorrect -> 0xe4f3), seq 3079296399, win 65535, options [mss 1440,sackOK,TS val 1764520547 ecr 0,nop,wscale 9], length 0
12:12:25.331804 IP (tos 0x0, ttl 64, id 14069, offset 0, flags [DF], proto TCP (6), length 52)
    10-135-181-241.calico-typha.kube-system.svc.cluster.local.43005 > falco-gpms5.8765: Flags [.], cksum 0xb060 (incorrect -> 0x4dc0), seq 3079296400, ack 3540563484, win 128, options [nop,nop,TS val 1764520547 ecr 4123936361], length 0
12:12:25.331814 IP (tos 0x0, ttl 64, id 18382, offset 0, flags [DF], proto TCP (6), length 60)
    10-135-181-241.calico-typha.kube-system.svc.cluster.local.43019 > falco-gpms5.8765: Flags [S], cksum 0xb068 (incorrect -> 0xd20c), seq 3857332744, win 65535, options [mss 1440,sackOK,TS val 1764520547 ecr 0,nop,wscale 9], length 0
12:12:25.331876 IP (tos 0x0, ttl 64, id 18383, offset 0, flags [DF], proto TCP (6), length 52)
    10-135-181-241.calico-typha.kube-system.svc.cluster.local.43019 > falco-gpms5.8765: Flags [.], cksum 0xb060 (incorrect -> 0xdb75), seq 3857332745, ack 1341364373, win 128, options [nop,nop,TS val 1764520547 ecr 4123936361], length 0
12:12:25.331966 IP (tos 0x0, ttl 64, id 14070, offset 0, flags [DF], proto TCP (6), length 164)
    10-135-181-241.calico-typha.kube-system.svc.cluster.local.43005 > falco-gpms5.8765: Flags [P.], cksum 0xb0d0 (incorrect -> 0x9fd0), seq 0:112, ack 1, win 128, options [nop,nop,TS val 1764520548 ecr 4123936361], length 112
12:12:25.331997 IP (tos 0x0, ttl 64, id 18384, offset 0, flags [DF], proto TCP (6), length 164)
    10-135-181-241.calico-typha.kube-system.svc.cluster.local.43019 > falco-gpms5.8765: Flags [P.], cksum 0xb0d0 (incorrect -> 0x2d86), seq 0:112, ack 1, win 128, options [nop,nop,TS val 1764520548 ecr 4123936361], length 112
12:12:25.332127 IP (tos 0x0, ttl 64, id 14071, offset 0, flags [DF], proto TCP (6), length 52)
    10-135-181-241.calico-typha.kube-system.svc.cluster.local.43005 > falco-gpms5.8765: Flags [.], cksum 0xb060 (incorrect -> 0x4cf4), seq 112, ack 91, win 128, options [nop,nop,TS val 1764520548 ecr 4123936362], length 0
12:12:25.332282 IP (tos 0x0, ttl 64, id 18385, offset 0, flags [DF], proto TCP (6), length 52)
    10-135-181-241.calico-typha.kube-system.svc.cluster.local.43019 > falco-gpms5.8765: Flags [.], cksum 0xb060 (incorrect -> 0xdaa9), seq 112, ack 91, win 128, options [nop,nop,TS val 1764520548 ecr 4123936362], length 0
12:12:25.332311 IP (tos 0x0, ttl 64, id 18386, offset 0, flags [DF], proto TCP (6), length 52)
    10-135-181-241.calico-typha.kube-system.svc.cluster.local.43019 > falco-gpms5.8765: Flags [.], cksum 0xb060 (incorrect -> 0xda99), seq 112, ack 107, win 128, options [nop,nop,TS val 1764520548 ecr 4123936362], length 0
12:12:25.332366 IP (tos 0x0, ttl 64, id 18387, offset 0, flags [DF], proto TCP (6), length 52)
    10-135-181-241.calico-typha.kube-system.svc.cluster.local.43019 > falco-gpms5.8765: Flags [F.], cksum 0xb060 (incorrect -> 0xda97), seq 112, ack 108, win 128, options [nop,nop,TS val 1764520548 ecr 4123936362], length 0
12:12:25.332392 IP (tos 0x0, ttl 64, id 14072, offset 0, flags [DF], proto TCP (6), length 52)
    10-135-181-241.calico-typha.kube-system.svc.cluster.local.43005 > falco-gpms5.8765: Flags [.], cksum 0xb060 (incorrect -> 0x4ce4), seq 112, ack 107, win 128, options [nop,nop,TS val 1764520548 ecr 4123936362], length 0
12:12:25.332461 IP (tos 0x0, ttl 64, id 14073, offset 0, flags [DF], proto TCP (6), length 52)
    10-135-181-241.calico-typha.kube-system.svc.cluster.local.43005 > falco-gpms5.8765: Flags [F.], cksum 0xb060 (incorrect -> 0x4ce2), seq 112, ack 108, win 128, options [nop,nop,TS val 1764520548 ecr 4123936362], length 0
^C
12 packets captured
14 packets received by filter
0 packets dropped by kernel
`````
Environment

Falco version:
0.33.1
System info:
`````
* Looking for a falco module locally (kernel 4.15.0-194-generic)
* Filename 'falco_ubuntu-generic_4.15.0-194-generic_205.ko' is composed of:
 - driver name: falco
 - target identifier: ubuntu-generic
 - kernel release: 4.15.0-194-generic
 - kernel version: 205
`````

**Comment by sofiafernandezmoreno** [comment]
No answer
